text,확진자수_pred,확진자수_gt,완치자수_pred,완치자수_gt,사망여부_pred,사망여부_gt,집단감염_pred,집단감염_gt,백신관련_pred,백신관련_gt,방역지침_pred,방역지침_gt,경제지원_pred,경제지원_gt,마스크_pred,마스크_gt,국제기구_pred,국제기구_gt,병원관련_pred,병원관련_gt
" [UNK] i stayed in berlin for about a year from early august to last month to spend my research year at the invitation of germany . the most severe was the most severe , with more than 30 , 000 confirmed , and more than 900 deaths per day , and eventually prime minister angela merkel has launched a wide range of secondary blocks since november 2 last year . all shops and institutions except gas station and mart have been closed . the restaurant , hotel , and shopping malls are all gathered . injured berlin turned into a ghost city . during the cold weather , i had three impressive experiences . at the end of the day , the government presented a guideline for all students for less than 100 , 000 people per 100 , 000 people for a week . the rules for defense were required . wearing a mask , and receiving the corona - test two times a week on the teacher ' s guidance in the classroom . however , in 15 minutes , there is an advantage of knowing the results . above all , it is quite effective in filtering asymptomatic propagators . you must meet one of the 3gs , each who received a voice from the prompt test on the day , a person who was caught in corona , and a person who completed the vaccination two times . the whole was widely discussed . it originated from the eye of preparing for the sashimi . second , reports on the difficulties of cultural artists such as theater , theater , exhibition , and performances were noticed . in germany ' s public broadcasting news , more than two or three reports were reported . some people can ask , ' is it because the country is relaxed ? ' that ' s right . but it is never a matter of money . the german public broadcasting news checked the whole society as a whole . without this balance and detail , it would not have been informed of the situation of cultural artists in the blind spot of interest . third , respect for the book was exceptional . in the midst of endless blockade , public libraries and local bookstores were first opened . the public library opened every afternoon every week , and the local bookstore welcomed guests by complying with wearing masks and restrictions on the number of people . even in the harsh time , i could feel the love of cultural welfare infrastructure and the love of the german books . the bookstore was a natural walking course for local residents , and it was energetic enough to display a new book every week on the show window . it seemed to be the mental basis of the country",1,0,0,0,0,0,0,0,1,0,1,1,0,0,1,1,0,0,0,0
" "" among the three types of corona 19 - year - olds approved in the united states , the coders of the us disease control and prevention center , cdc , where the product is the most effective in prevention of hospitalization . a survey of american adults with no damage found that the effects of vaccines that prevent the hospitalization of corona 19 were 93 % of modern or vaccine , 88 % of pfizers , and 71 % of jansen . from march 11 to august 15 this year , 18 states and 21 hospitals said that it was made against 3 , 689 adults admitted to corona 19 . cdc is \ "" this data from the real world is every vaccine . it shows that there is a slight difference in the level of protection effect , but all the vaccines approved by the food pharmacy , the fda , provide a significant effect to prevent hospitalization due to corona 19 . [UNK] the biggest difference between pfizer and moder or vaccine was because of the decrease in immunity from those who finished the pfizer and vaccine , cdc pointed out that cdc pointed out . however , after 120 days , the efficacy fell to 77 % . "" it ' s because of the difference in the group . "" the research team said that the results of this survey showed that the modera and pfizer vaccine , which were inoculated twice in the real world , provided a stronger protection effect than the jansen vaccine . \ "" jansen vaccine also lowered the risk of admission to corona 19 by 71 % . "" however , the research team said that this study is a vaccine for the corona 19 infections that are not serious enough to be admitted to children , an adult with a child , an immune system , and a hospital . i explained that there is a limit because it is not reviewed . [UNK]",0,0,0,0,0,0,0,0,1,1,0,0,0,0,0,0,0,0,0,0
" "" bucheon = newsis jung il - hyung reporter = bucheon , gyeonggi - do , announced on the 23rd that it will be vaccinated free of charge to improve the treatment of long - term care agents working in long - term care institutions . nursing caregivers , physical therapists , work therapists , nursing ( assistants ) , social workers , etc . he is a long - term care agent under 64 years of age ( born after january 1 , 1957 ) . you can vaccine at the hospital where the subject wishes . on the other hand , bucheon has been trying to improve the treatment of long - term care agents since its enactment of the ordinance on improving the treatment of long - term care agents and improving the status of bucheon in 2018 . the long - term care agent free flu vaccination project began last year , and in june , we opened the bucheon long - term care center support center to provide education and consultation to improve the treatment of long - term care agents .",0,0,0,0,0,0,0,0,1,1,0,0,0,0,0,0,0,0,0,0
" "" the claim of violating the corona 19 quarantine rules for the former prosecutor ' s palm of the prosecutor ' s general , the national assembly ' s health and welfare committee ' s national audit . the opposition party rebelled as a political intention . democratic party lawmaker chung eun - kyung , who was inquiring to the head of the centers for disease control and prevention , mentioned yoon ' s ' king ' . "" if you were writing in the letters , you would have been holding hands , but it wasn ' t a violation of the rules . "" [UNK] it is a remark that is in mind that mr . yoon ' s explanation is in mind . in the actual rules , wash his hands for more than 30 seconds , and to do not have a handshake or hug . "" it ' s hard to judge with only photos and homes , "" he said . kang ki - yoon , a member of the national assemblyman , said , [UNK] i used the questions politically even though the ruling and opposition parties discussed to be faithful to the national assembly , [UNK] kim said . [UNK] the former president was controversial in the camera , which was drawn to the camera on the left hand in the process of attending the national presidential election tv debate . i explained that it was not erased . """,0,0,0,0,0,0,0,0,0,0,0,0,0,0,0,0,0,0,0,0
" "" citizens are vaccinating at the vaccination center at the buk - ah culture and sports center in seodaemun - gu , seoul , when the first vaccination of the corona 19 - year - old exceeded 40 million people .",0,0,0,0,0,0,0,0,1,1,0,0,0,0,0,0,0,0,0,0
" "" kbs chuncheon hongcheon ' s parameters of the corona 19 chain are continuing . gangwon - do said that two people of the corona - related corona 19 - positive confirmed confirmed in hongcheon today ( 25th ) . three of them have increased to eight people , and the other five are guests and acquaintances . there are seven cities , including 4 chuncheon , and 19 . [UNK]",1,1,0,0,0,0,0,1,0,0,0,0,0,0,0,0,0,0,0,0
" "" the proliferation of the new corona virus infection ( corona 19 ) has not been calmed down , and the police have been cracking down for two months on mask fertilization , because various violence and civil service disruptions have reached a risk level due to the lack of masks . the national police agency announced on the 30th that it will promote intensive crackdown on ' violence around life ' for two months from 1st to october 31st of next month . it is expected to focus on the crackdown . it is a public official ' s violence ( including malicious complaints ) in the public affairs site , especially after the mandatory mandatory wearing masks , to 1988 cases received by fertilization of masks in and out of public transportation until august as of august , of which 26 the police were arrested . the police plan to respond strictly , such as the use of weapons , the case of serious damage , the socially weak , or the unspecified majority of the unspecified majority , such as criminal punishment . in order to collaborate with related functions and institutions , we will establish a system that can respond organically and comprehensively throughout the case , from preventive activities to collecting intelligence , criminal investigation , and victims . while communicating , we plan to induce reports and reports , such as reducing responsibility for reporters or victims ' minor offenses . the company plans to examine the processing of recruitment with a comprehensive investigation , and in connection with the victims in conjunction with the victims of the victims , support for the realization of the rights of criminal procedures and the recovery of the damage , and the other type against the violent act of the offender . in the case of exercise , it will be actively relieved by applying party defense . an official said , "" we plan to carry out strong enforcement activities on the chronic violence crimes around our lives in order to restore the calm daily life and establish strict legal order and public power . """,0,0,0,0,0,0,0,0,0,0,0,0,0,0,1,1,0,0,0,0
" "" the government is praising self - confidence every day , but there are citizens who are tired of ' hard life ' behind them . they are more afraid of life bills that are coming to the new corona virus infection ( corona 19 ) . if you are sick , we ' re sick too . it is a socially underprivileged in various forms , such as delivery workers who had to face the door , and migrants who cannot be read even if they receive disaster safety text messages . the author lee jae - ho said in a non - face - to - face interview on the 22nd , the park geun - hye administration ' s mers has been transparent and the response has been made faster , but i don ' t think so . [UNK] "" if you can ' t improve even this point , you should not play a national role . "" shouldn ' t people have to endure the streets between the weak who can ' t be distant , and still have to stand more powerful . [UNK] it is said that it was applied to the courier workers , while the courier workers had to suffer excessive labor from the outside while they were reluctant to leave the house due to home work and the spread of the ' home ' culture . as a result of surveying the average working hours , they worked 71 . 3 hours per share , and the issue of unemployment and gender inequality was also raised . there are 620 , 000 women in the middle , 1 . 5 times more than men . lost . 62 % of women and 38 % of men used caring vacations through the cost of care paid by the ministry of employment and labor . with the corona 19 shock , women suffered a greater unemployment and care crisis than men . the author said , [UNK] when i was covering the mers crisis in 2015 , i looked a little deeper than others , and eventually there was a perception that the virus was not a matter of medicine and science , but a matter of solving it in our society and politics . [UNK] many corona books have been released during the year , but i thought i should write a book that i look at with the problem i have because there was only a book written in terms of viruses and medicine . [UNK] [UNK] let ' s listen to the voices of people who have not been able to speak , and face the bare face of our society , [UNK] he said . we are thoroughly on the sacrifice of the weak . [UNK] the author of this book is a reporter for the hank",0,0,0,0,0,0,0,0,0,0,0,0,0,0,0,0,0,0,0,0
" "" herald economy = park seung - won ' s new reporter confirmed 1 , 865 people , 1 , 800 units for two consecutive days . . .",1,1,0,0,0,0,0,0,0,0,0,0,0,0,0,0,0,0,0,0
" "" 182 places who operated a lodging company without a report were caught by the police . according to the results of the seoul police agency ' s tourism police corps from 6th to 28th , 182 cases of superstition accommodations , basic order violations ( violation of basic order ) 213 cases , including 13 garbage dumping , were caught in illegal tourism , and in this crackdown , 26 officetels from university streets were borrowed , and companies that were operating as rooms were caught . in addition , a company that provided a company was found . ▲ companies that operated a women ' s share house without reporting accommodation ▲ cases of operating rooms in youth houses were also caught . sanitation and fire risks are also increasing . [UNK] [UNK] we will continue to crack down on accommodations . [UNK]",0,0,0,0,0,0,0,0,0,0,0,0,0,0,0,0,0,0,0,0
" "" sejong = newsis reporter lim jae - hee = the number of new confirmed candidates was 1729 as corona 19 continued during the chuseok holiday . despite the chuseok holiday , the number of confirmed candidates exceeded 1 , 700 for the first time . according to the defense countermeasure headquarters , the confirmed person is 28 , 9263 , up 1729 from the previous day . the size of the confirmed person , which was 2 , 000 in three days from the 15th to the 18th , decreased in the weekend and chuseok holidays , but the decrease in the line was not significant compared to the previous weekend . it is the largest number of days by day . it tends to decrease the number of patients by monday due to the decrease in weekend inspections , and this time , the chuseok holiday ( 19 - 22 ) is a holiday , but the number of confirmation on monday is 120 than the previous day . myeong , more than 230 people a week ago . considering that it takes 1 - 2 days to reflect in the statistics after the diagnosis test , the confirmed person is interpreted as a weekend and chuseok holiday , the 19th and 20th test results . there are 1697 people and 32 overseas inflow confirmed . the average number of domestic occurrences per day is increasing in 1800 people from the 19th to the 3rd . 23 . 3 % ) .",1,1,0,0,0,0,0,0,0,0,0,0,0,0,0,0,0,0,0,0
" "" ( seoul = yonhap news ) reporter kim jin - bang = in the united states , halloween day , the largest festival in autumn during the 19th trend of corona , is approaching the autumn festival . pouch said that if you appear on cnn on the 10th ( local time ) , if you wear a mask , it is safe to play ' trick orshire ' ( halloween candy ) . it is a good time to think about whether it is important to receive it . "" he urged the vaccine to receive vaccinations before halloween . it will contribute to enjoying it . "" he emphasized that "" the federal government ' s review of the data that will determine whether the children aged 5 - 12 will be the target of vaccination \ "" \ "" . "" you can do a trick or treet ' \ "" \ "" you have to enjoy most of the time in the outdoors when children are doing ' trick or trit ' . i am now a favorite time for children and a very important time for children . wandering around the streets , and the children go to their neighbors and eat candy . trick or treat ) said it could allow a small scale , and the director of the pouch recommends enjoying halloween on this premise , but still emphasized that it should not be declared ' full victory ' yet . at the time of the holiday season , you should celebrate the good news of reducing the corona 19 confirmed person , but you should not declare a full victory over corona 19 . "" pouch did not mention the government ' s mandatory vaccination of passengers and crew who traveled like canada ahead of the winter holiday season . the flight is used . pouch , when asked how time it takes for vaccines to take off the mask indoors , \ "" need to watch the trend of corona 19 in the community . "" he said he was just going in the right direction ( corona 19 trend ) , but the number of confirmers a day is still a little less than 100 , 000 . "" "" i said . "" "" we want to lower the number of confirmation . my words are much lower than 10 , 000 people and even lower than that , [UNK] he said . [UNK] but the number of 95 , 000 people still means that there is still a high dynamic circulation of the virus in the community . [UNK] pouch said , "" we have seen the history of surge and decrease . it can survive again \ "" \ "" i don ' t",0,1,0,0,0,0,0,0,0,1,1,0,0,0,1,1,0,0,0,0
" "" financial news gwangju = hwang tae - jong reporter ] 42 people and 17 confirmed per day in gwangju and jeonnam , respectively . 42 people were confirmed as 4762 ~ 4803 , and were confirmed by 42 people confirmed . in addition , △ 1 person related to the confirmed person in seocho - gu , seoul △ one person related to the confirmed candidates for namyangju - si , gyeonggi - do , was diagnosed with 19 confirmed corona . it is a region of 5 suncheon - si , two in boseong - gun , jangheung - gun , and yeongam - gun , one in mokpo , naju , gwangyang , goheung - gun , muan - gun , and sinan - gun . 4 people △ 4 people who have not confirmed the path of infection . """,1,1,0,0,0,0,1,0,0,0,0,0,0,0,0,0,0,0,0,0
" "" gyeonggi - do runs a vaccine bus , which is a visiting corona 19 vaccination bus that visits foreign dense workplaces and provides vaccinations . it is due to the low vaccine vaccination rate for unregistered foreigners . according to gyeonggi - do , the inoculation rate is 74 . 7 % for registered foreigners ( about 52 , 000 people in gyeonggi - do ) , similar to 75 . 0 % of koreans , but unregistered foreigners ( about 100 , 000 people in gyeonggi - do ) are 55 . 9 % ( estimated ) , which is lower than that of koreans . it is estimated that the lack of recognition of workers and business owners and business owners ' vaccination and complex vaccination procedures are the cause of the reduction of unregistered foreign vaccines . until the 8th , the vaccine bus will be piloted in the ansan area , where foreign workers live the most . the demand survey by city and county will be conducted by the city and county , and the ' vaccine bus ' will be operated by the end of october . it is the first time in gyeonggi - do to operate the bus , and the vaccine bus is used as the bus that was used as a foreign workers ' mobile health checkup project , with four doctors , two nurses , and one driver . gyeonggi - do was in the first ' vaccine bus ' at the gyeonggi regional headquarters of the korea industrial complex corporation in danwon - gu , ansan - si on the 6th . vaccine buses can be inoculated by more than 100 episodes per day . if the identity is confirmed , such as a certificate , the temporary management number is given and vaccinated directly in the field . ' inoculs . 18 - 29 years old inoculate the mrna vaccine ( pfizer , modera , etc . ) in consideration of vaccine supply and demand conditions by city and county . """,0,0,0,0,0,0,0,0,1,1,0,0,0,0,0,0,0,0,0,0
" [ kim seung - hee , minister of welfare , minister of welfare , past remarks bonns , a controversial areas of the hate , and emphasized ' wuhan pneumonia ' . i am in . actress kim seung - hee , a minister of health and welfare minister , has been confirmed to have claimed that corona 19 as a member of the national assembly , "" we will call it ' wuhan pneumonia ' without following the world health organization ( who ) recommendation . "" the who recommends that the name of the new infectious disease can not be put into the name of the new type of infectious diseases because it can encourage disgust and prejudice against a particular area . this is coming out on the 2nd , and it was confirmed that kim could not follow the who recommendation in relation to corona 19 in february 2020 , when he was a member of the liberal democratic party . the who has previously set the 2019 new corona virus infection ( 2019 - ncov ) as the official name . "" why should i follow who ? "" representative of the korean party is holding the first meeting of the new corona virus infection . on the left is senator kim seung - hee , a tf secretary . oh dae - geun , a reporter , insisted that in february of that year , the liberal democratic party ' s wuhan pneumonia measures task force ( tf ) insisted that ' wuhan ' should be put in when they sing corona 19 . this is because it developed in wuhan , china . at the time , the panel who attended the debate pointed out that "" it has already been called to corona 19 , not wuhan pneumonia , as it has already spread throughout china as well as overseas countries , and it is not pneumonia . "" it ' s easy . the who published a guideline for the disease name principle in may 2015 , avoiding the geographical location or occupation in the name , and not to use the words that encouraged fear . the intention is to prevent the stigma effect . at the time , the ruling party said , "" is it going to be a political fight with corona ? "" candidate kim seung - hee , a minister of health and welfare , went to work at the seoul district district headquarters in seodaemun - gu , seoul on the afternoon of last month . news 1 kim also took the lead in criticizing the government and ruling party at the time , saying , "" please refrain from expressing pneumonia .",0,0,0,0,0,0,0,0,0,0,0,0,0,0,0,0,1,1,0,0
" "" a fire broke out at a romanian infectious disease hospital that treats 19 patients with corona , and nine people were killed . the fire occurred in the intensive care unit of the infectious disease hospital in constan , romania port . there was also a video that some patients jumped out of the hospital window to avoid flames . the hospital said 113 patients were in hospital , and all patients were evacuated and the fire was suppressed .",1,0,0,0,0,0,0,0,0,0,0,0,0,0,0,0,0,0,0,1
" "" inje , hongcheon , and goseong , where kbs chuncheon african pig pilot ' asf ' occurred , was released at 0 o ' clock today ( 1 day ) . in the prosecutor ' s prosecutor ' s prosecutor , which was implemented 30 days after the completion of the burial of the pig farm in hongcheon and goseong area , all three regions said they had a final voice . asf has occurred , resulting in a restriction on movement . """,1,0,0,0,0,0,0,0,0,0,0,0,0,0,0,0,0,0,0,0
" "" on the 10th , the number of new confirmed people was close to 1 , 600 on the 10th . the number of confirmed candidates was 359 lower than the previous day ( 1 , 953 ) , maintaining 2 , 000 people below for two consecutive days . according to the infection of new confirmers , there are 1 , 560 regional occurrences and 34 overseas inflows . from july 7th ( 1 , 211 people ) to four digits for 96 consecutive days . he recorded 2 , 425 people → 2 , 175 → 1 , 953 → 1 , 594 , and 2 , 000 people were confirmed three times . """,1,1,0,0,0,0,0,1,0,0,0,0,0,0,0,0,0,0,0,0
" [ china daily press [UNK] china ' s state - of - the - art reports that china ' s state - of - the - art reports were reported on the 15th that corona 19 did not occur in china , but because of the us beach lobster imported from wuhan , not in china . the media reported on the basis of ' e - cigarette pneumonia ' that occurred in the united states before december , and the media said , "" in july 2019 , pneumonia related to e - cigarettes occurred in the united states , and the us beach lobster was imported into wuhan in november . "" he insisted that "" group infections occurred in wuhan ' s angry aquatic wholesale market . "" china daily press video capture , [UNK] the first person who touched the us beach and lobster wrapping paper was the first to infect corona 19 among the market merchants , [UNK] he said . the report of the report has disappeared , [UNK] he said . [UNK] did the disease really disappeared in the united states ? [UNK] he continued to argue that the united states intentionally tried to hide the disease . it is not presented with scientific evidence , such as the corona 19 virus and the homogeneity of the virus from the united states . i introduced it . china ' s daily press capture the report was a hot issue with 80 million views in the social media weibo , china , in two hours , and on the other hand , from the claim that the corona 19 origin was leaked from a research institute in wuhan to angered seafood wholesale market . there is a speculation , but it is not clear . ] ]",1,0,0,0,0,0,0,1,0,0,0,0,0,0,0,0,1,0,0,0
" "" ( daegu = news1 ) fair - style reporter = yurim , who attended the new year ' s chukjeon seokjeon great festival held in front of daegu hyanggyo daeseongjeon in namsan - dong , jung - gu , daegu on the 16thin order to prevent it , daegu hyanggyo has been wearing a mask . daegu hyanggyo has complied with defense rules and completed the second vaccination to prevent corona 19 . 2021 . 9 . 16 / news 1 """,0,0,0,0,0,0,0,0,1,0,0,0,0,0,1,1,0,0,0,0
